{
  "schemaVersion": 1,
  "datasetId": "place-resolution-v1",
  "description": "Curated place-identity and branch-resolution cases for Japan Atlas Add. Ratings and other volatile enrichment fields are intentionally out of scope.",
  "checkedAt": "2026-09-25",
  "entities": {
    "tokyo-mentsudan-shinjuku": {
      "canonicalName": "讃岐うどん大使 東京麺通団",
      "branchId": "shinjuku-west-exit",
      "branchName": "Shinjuku West Exit",
      "countryCode": "JP",
      "locality": "Shinjuku City, Tokyo",
      "address": "東京都新宿区西新宿7-9-15 ダイカンプラザ ビジネス清田ビル1F",
      "sourceUrl": "https://tabelog.com/tokyo/A1304/A130401/13004352/",
      "checkedAt": "2026-09-25"
    },
    "koffee-mameya-kakeru-koto": {
      "canonicalName": "KOFFEE MAMEYA Kakeru",
      "branchId": "hirano",
      "branchName": "Hirano",
      "countryCode": "JP",
      "locality": "Koto City, Tokyo",
      "address": "東京都江東区平野2-16-14",
      "sourceUrl": "https://tabelog.com/tokyo/A1313/A131303/13255632/",
      "checkedAt": "2026-09-25"
    },
    "katsuretsu-yotsuya-takeda": {
      "canonicalName": "かつれつ四谷たけだ",
      "branchId": "yotsuya",
      "branchName": "Yotsuya",
      "countryCode": "JP",
      "locality": "Shinjuku City, Tokyo",
      "address": "東京都新宿区四谷1-4-2 峯村ビル1F",
      "sourceUrl": "https://tabelog.com/tokyo/A1309/A130902/13131643/",
      "checkedAt": "2026-09-25"
    },
    "ebimaru-jimbocho": {
      "canonicalName": "海老丸らーめん",
      "branchId": "jimbocho",
      "branchName": "Jimbocho",
      "countryCode": "JP",
      "locality": "Chiyoda City, Tokyo",
      "address": "東京都千代田区西神田2-1-13 十勝ビル1F",
      "sourceUrl": "https://tabelog.com/tokyo/A1310/A131003/13212911/",
      "checkedAt": "2026-09-25"
    },
    "spicy-curry-roka-okubo": {
      "canonicalName": "SPICY CURRY 魯珈",
      "branchId": "okubo",
      "branchName": "Okubo",
      "countryCode": "JP",
      "locality": "Shinjuku City, Tokyo",
      "address": "東京都新宿区百人町1-24-8 新宿タウンプラザBF-J",
      "sourceUrl": "https://tabelog.com/tokyo/A1304/A130404/13286023/",
      "checkedAt": "2026-09-25"
    },
    "gancon-noodle-komagome": {
      "canonicalName": "ガンコンヌードル",
      "branchId": "komagome",
      "branchName": "Komagome",
      "countryCode": "JP",
      "locality": "Kita City, Tokyo",
      "address": "東京都北区中里1-3-3 板橋ビル1F",
      "sourceUrl": "https://tabelog.com/tokyo/A1323/A132301/13147756/",
      "checkedAt": "2026-09-25"
    },
    "aldebaran-azabu-juban": {
      "canonicalName": "アルデバラン",
      "branchId": "azabu-juban",
      "branchName": "Azabu-Juban",
      "countryCode": "JP",
      "locality": "Minato City, Tokyo",
      "address": "東京都港区麻布十番3-3-1 三喜ビル3F",
      "sourceUrl": "https://tabelog.com/tokyo/A1307/A130702/13278678/",
      "checkedAt": "2026-09-25"
    },
    "kabuto-ikebukuro": {
      "canonicalName": "かぶと",
      "branchId": "ikebukuro",
      "branchName": "Ikebukuro",
      "countryCode": "JP",
      "locality": "Toshima City, Tokyo",
      "address": "東京都豊島区池袋2-53-2 池袋ESビル1F",
      "sourceUrl": "https://tabelog.com/tokyo/A1305/A130501/13016660/",
      "checkedAt": "2026-09-25"
    },
    "yardbird-sheung-wan": {
      "canonicalName": "Yardbird",
      "branchId": "sheung-wan",
      "branchName": "Sheung Wan",
      "countryCode": "HK",
      "locality": "Hong Kong",
      "address": "G/F, 154-158 Wing Lok Street, Sheung Wan, Hong Kong",
      "sourceUrl": "https://yardbirdrestaurant.com/terms-of-use",
      "checkedAt": "2026-09-25"
    },
    "dishoom-covent-garden": {
      "canonicalName": "Dishoom",
      "branchId": "covent-garden",
      "branchName": "Covent Garden",
      "countryCode": "GB",
      "locality": "London",
      "address": "12 Upper St. Martin's Lane, London WC2H 9FB",
      "sourceUrl": "https://www.dishoom.com/covent-garden/",
      "checkedAt": "2026-09-25"
    },
    "superiority-burger-east-village": {
      "canonicalName": "Superiority Burger",
      "branchId": "east-village",
      "branchName": "East Village",
      "countryCode": "US",
      "locality": "New York, NY",
      "address": "119 Avenue A, New York, NY 10009",
      "sourceUrl": "https://www.superiorityburger.com/contact",
      "checkedAt": "2026-09-25"
    },
    "ho-lee-fook-central": {
      "canonicalName": "Ho Lee Fook",
      "branchId": "central",
      "branchName": "Central",
      "countryCode": "HK",
      "locality": "Hong Kong",
      "address": "3-5 Elgin Street, Central, Hong Kong",
      "sourceUrl": "https://guide.michelin.com/en/hong-kong-region/hong-kong/restaurant/ho-lee-fook",
      "checkedAt": "2026-09-25"
    }
  },
  "cases": [
    {
      "caseId": "jp-exact-tokyo-mentsudan",
      "query": "讃岐うどん大使 東京麺通団",
      "tags": ["japanese", "full-name", "japan"],
      "gold": {
        "expectedAction": "resolve",
        "identityId": "tokyo-mentsudan-shinjuku",
        "branchId": "shinjuku-west-exit",
        "sourceUrls": ["https://tabelog.com/tokyo/A1304/A130401/13004352/"],
        "checkedAt": "2026-09-25"
      }
    },
    {
      "caseId": "zh-mixed-tokyo-mentsudan",
      "query": "东京麺通団 新宿",
      "tags": ["chinese", "mixed-script", "branch-hint", "japan"],
      "gold": {
        "expectedAction": "resolve",
        "identityId": "tokyo-mentsudan-shinjuku",
        "branchId": "shinjuku-west-exit",
        "sourceUrls": ["https://tabelog.com/tokyo/A1304/A130401/13004352/"],
        "checkedAt": "2026-09-25"
      }
    },
    {
      "caseId": "romaji-tokyo-mentsudan",
      "query": "Tokyo Mentsudan Shinjuku",
      "tags": ["romanized", "english", "branch-hint", "japan"],
      "gold": {
        "expectedAction": "resolve",
        "identityId": "tokyo-mentsudan-shinjuku",
        "branchId": "shinjuku-west-exit",
        "sourceUrls": ["https://tabelog.com/tokyo/A1304/A130401/13004352/"],
        "checkedAt": "2026-09-25"
      }
    },
    {
      "caseId": "en-full-koffee-mameya-kakeru",
      "query": "KOFFEE MAMEYA Kakeru",
      "tags": ["english", "full-name", "japan"],
      "gold": {
        "expectedAction": "resolve",
        "identityId": "koffee-mameya-kakeru-koto",
        "branchId": "hirano",
        "sourceUrls": ["https://tabelog.com/tokyo/A1313/A131303/13255632/"],
        "checkedAt": "2026-09-25"
      }
    },
    {
      "caseId": "jp-katakana-koffee-mameya",
      "query": "コーヒー マメヤ カケル 清澄白河",
      "tags": ["japanese", "alternate-name", "area-hint", "japan"],
      "gold": {
        "expectedAction": "resolve",
        "identityId": "koffee-mameya-kakeru-koto",
        "branchId": "hirano",
        "sourceUrls": ["https://tabelog.com/tokyo/A1313/A131303/13255632/"],
        "checkedAt": "2026-09-25"
      }
    },
    {
      "caseId": "zh-koffee-mameya-area",
      "query": "清澄白河那家 Koffee Mameya Kakeru",
      "tags": ["chinese", "mixed-script", "area-hint", "japan"],
      "gold": {
        "expectedAction": "resolve",
        "identityId": "koffee-mameya-kakeru-koto",
        "branchId": "hirano",
        "sourceUrls": ["https://tabelog.com/tokyo/A1313/A131303/13255632/"],
        "checkedAt": "2026-09-25"
      }
    },
    {
      "caseId": "jp-partial-yotsuya-takeda",
      "query": "四谷たけだ",
      "tags": ["japanese", "incomplete-name", "area-hint", "japan"],
      "gold": {
        "expectedAction": "resolve",
        "identityId": "katsuretsu-yotsuya-takeda",
        "branchId": "yotsuya",
        "sourceUrls": ["https://tabelog.com/tokyo/A1309/A130902/13131643/"],
        "checkedAt": "2026-09-25"
      }
    },
    {
      "caseId": "romaji-yotsuya-takeda",
      "query": "Katsuretsu Yotsuya Takeda",
      "tags": ["romanized", "full-name", "japan"],
      "gold": {
        "expectedAction": "resolve",
        "identityId": "katsuretsu-yotsuya-takeda",
        "branchId": "yotsuya",
        "sourceUrls": ["https://tabelog.com/tokyo/A1309/A130902/13131643/"],
        "checkedAt": "2026-09-25"
      }
    },
    {
      "caseId": "jp-full-ebimaru",
      "query": "海老丸らーめん 神保町",
      "tags": ["japanese", "full-name", "area-hint", "japan"],
      "gold": {
        "expectedAction": "resolve",
        "identityId": "ebimaru-jimbocho",
        "branchId": "jimbocho",
        "sourceUrls": ["https://tabelog.com/tokyo/A1310/A131003/13212911/"],
        "checkedAt": "2026-09-25"
      }
    },
    {
      "caseId": "zh-incomplete-ebimaru",
      "query": "神保町海老丸",
      "tags": ["chinese", "japanese", "incomplete-name", "area-hint", "japan"],
      "gold": {
        "expectedAction": "resolve",
        "identityId": "ebimaru-jimbocho",
        "branchId": "jimbocho",
        "sourceUrls": ["https://tabelog.com/tokyo/A1310/A131003/13212911/"],
        "checkedAt": "2026-09-25"
      }
    },
    {
      "caseId": "jp-full-spicy-curry-roka",
      "query": "SPICY CURRY 魯珈 大久保",
      "tags": ["japanese", "english", "full-name", "area-hint", "japan"],
      "gold": {
        "expectedAction": "resolve",
        "identityId": "spicy-curry-roka-okubo",
        "branchId": "okubo",
        "sourceUrls": ["https://tabelog.com/tokyo/A1304/A130404/13286023/"],
        "checkedAt": "2026-09-25"
      }
    },
    {
      "caseId": "zh-simplified-roka",
      "query": "鲁珈咖喱 大久保",
      "tags": ["chinese", "incomplete-name", "area-hint", "japan"],
      "gold": {
        "expectedAction": "resolve",
        "identityId": "spicy-curry-roka-okubo",
        "branchId": "okubo",
        "sourceUrls": ["https://tabelog.com/tokyo/A1304/A130404/13286023/"],
        "checkedAt": "2026-09-25"
      }
    },
    {
      "caseId": "en-full-gancon-noodle",
      "query": "GANCON NOODLE Komagome",
      "tags": ["english", "romanized", "full-name", "area-hint", "japan"],
      "gold": {
        "expectedAction": "resolve",
        "identityId": "gancon-noodle-komagome",
        "branchId": "komagome",
        "sourceUrls": ["https://tabelog.com/tokyo/A1323/A132301/13147756/"],
        "checkedAt": "2026-09-25"
      }
    },
    {
      "caseId": "jp-gancon-katakana",
      "query": "ガンコンヌードル 駒込",